Categoria,Artigo,Descricao,Fonte,Link
Painéis LED,Decreto 976/2024,Luminância máxima deve ser reduzida em 50% entre 22h e 06h para controle de poluição visual.,Artigo 30 Inciso I,https://leismunicipais.com.br/a/pr/c/curitiba/decreto/2024/97/976
Painéis LED,Decreto 976/2024,Área máxima de exposição não pode exceder 20% da face da fachada onde o engenho está instalado.,Artigo 12 Parágrafo 2,https://leismunicipais.com.br/a/pr/c/curitiba/decreto/2024/97/976
Recuos,Lei 15.511/2019,É proibida a instalação de qualquer engenho de publicidade ou estrutura fixa dentro da faixa de recuo frontal (5m).,Artigo 42 e Artigo 62,https://bit.ly/lei-15511-curitiba
Calçadas,Decreto 1066/2006,O passeio deve possuir faixa livre de no mínimo 1.50m. Mobiliário urbano ou vegetação não podem obstruir essa área.,Artigo 10 Parágrafo 1,https://www.curitiba.pr.gov.br/servicos/calcadas-padrao-execucao/623
Zoneamento,Lei 15.511/2019,Taxa de Ocupação: Em zonas ZR2 e ZR3 a ocupação máxima do lote é de 50%. Coeficiente de aproveitamento padrão 1.0.,Artigo 55 Tabela Geral,https://bit.ly/lei-15511-curitiba
Acessibilidade,Decreto 2397/2023,O rebaixo de guia para acesso de veículos deve ter largura máxima de 3.00m e não pode alterar o nível da faixa livre.,Artigo 15 Inciso III,https://bit.ly/dec-2397-curitiba
Publicidade,Decreto 976/2024,Transição de imagens em painéis digitais deve ser estática (sem vídeos) com intervalo mínimo de 8 segundos por inserção.,Artigo 15 Parágrafo Único,https://leismunicipais.com.br/a/pr/c/curitiba/decreto/2024/97/976
Muros,Decreto 1066/2006,Muros frontais acima de 0.90m de altura devem possuir no mínimo 50% de transparência visual (grades/vidros).,Artigo 18,https://www.curitiba.pr.gov.br/servicos/calcadas-padrao-execucao/623
