Categoria,Artigo,Descricao,Fonte,Link
Acessibilidade,Decreto 2397/23,Rampas de acesso para veículos devem respeitar a largura máxima de 3.00m no alinhamento predial.,Artigo 15 Inciso III,https://bit.ly/dec-2397-curitiba
Calçadas,Decreto 1066/06,A faixa livre para circulação de pedestres deve ser de no mínimo 1.50m e ter superfície regular e antiderrapante.,Artigo 10 Parágrafo 1,https://www.curitiba.pr.gov.br/servicos/calcadas-padrao-execucao/623
Acessibilidade,NBR 9050,Inclinação de rampas: A inclinação máxima permitida para pedestres é de 8.33%. Acima disso o acesso é irregular.,Item 6.6.2.1,https://bit.ly/nbr9050-completa
Urbanismo,Decreto 1066/06,Degraus e obstáculos: É expressamente proibido o uso de degraus ou qualquer obstáculo físico na faixa livre da calçada.,Artigo 11,https://www.curitiba.pr.gov.br/servicos/calcadas-padrao-execucao/623
Calçadas,Lei 11.095/04,Rebaixo de Meio-fio: Deve ser executado garantindo a continuidade da calçada sem criar degraus para o pedestre.,Artigo 112,https://bit.ly/375966-lei-curitiba
Acessibilidade,NBR 9050,Piso Tátil: Obrigatório em rotas acessíveis para sinalizar mudança de direção ou obstáculos suspensos.,Item 5.4.6,https://bit.ly/nbr9050-completa
Urbanismo,Lei 11.095/04,A marquise ou beiral de edifícios deve estar a uma altura mínima de 3.00m em relação ao nível do passeio.,Artigo 72,https://bit.ly/375966-lei-curitiba
